{
  "schema_version": "1.0.0",
  "benchmark": "docksr-vulkan-scaler",
  "evidence_class": "vulkan_software",
  "device": {
    "name": "schema fixture, not a measured device",
    "type": "cpu",
    "vendor_id": 0,
    "device_id": 0,
    "api_version": "1.3.0",
    "driver_version": 0,
    "timestamp_valid_bits": 0,
    "timestamp_period_ns": 1.0,
    "driver_name": "synthetic fixture",
    "driver_info": "not observed",
    "queue_family": 0,
    "timestamps_enabled": false
  },
  "configuration": {
    "input_width": 2,
    "input_height": 2,
    "output_width": 3,
    "output_height": 3,
    "filter": "bilinear",
    "warmup_iterations": 0,
    "measured_iterations": 2,
    "changing_frames": true,
    "pattern": "gradient-edge-ui-pixel-art-v1",
    "final_input_frame_index": 1
  },
  "timings": {
    "host_dispatch_to_completion_ms": {
      "p50": 1.0,
      "p95": 1.5,
      "p99": 1.9,
      "min": 0.9,
      "max": 2.0
    },
    "gpu_dispatch_ms": null,
    "host_scope": "Synthetic schema-test fixture, not observed timings.",
    "timestamp_status": "unavailable: synthetic fixture",
    "quantile_method": "nearest-rank; measured iterations only",
    "gpu_scope": "Synthetic fixture, no GPU measurement."
  },
  "correctness": {
    "passed": true,
    "max_absolute_error": 0,
    "allowed_absolute_error": 1,
    "channels_compared": 36,
    "scope": "Synthetic schema example, no measured pixels."
  },
  "metrics": {
    "power_w": null,
    "game_internal_render_ms": null,
    "npu_ms": null,
    "game_fps": null
  },
  "limitations": [
    "Synthetic schema-test fixture; numbers are not measurements.",
    "No power, NPU, game FPS, or in-game render metrics were measured."
  ],
  "artifacts": {
    "input": {
      "path": "input.ppm",
      "hash": {
        "algorithm": "fnv1a64",
        "value": "0000000000000000"
      }
    },
    "output": {
      "path": "output.ppm",
      "hash": {
        "algorithm": "fnv1a64",
        "value": "0000000000000000"
      }
    },
    "samples": {
      "path": "samples.csv",
      "format": "csv",
      "columns": [
        "sample_index",
        "host_dispatch_to_completion_ms",
        "gpu_dispatch_ms",
        "input_frame_index"
      ]
    },
    "shader": {
      "hash": {
        "algorithm": "fnv1a64",
        "value": "0000000000000000"
      }
    }
  }
}
